"Mapping Method","Namespace","Descriptor Name","Code Value","Short Description","Description","Length of Short Desc"
"Core","uri://education.mn.gov/StudentCharacteristicDescriptor","StudentCharacteristicDescriptor","7","Displaced by Hurricanes, Tropical Storms, or Flooding in 20-21","Displaced by Hurricanes, Tropical Storms, or Flooding in 20-21","62"
"Core","uri://education.mn.gov/StudentCharacteristicDescriptor","StudentCharacteristicDescriptor","8","Displaced by Wildfires in 20-21","Displaced by Wildfires in 20-21","31"
"Core","uri://education.mn.gov/StudentCharacteristicDescriptor","StudentCharacteristicDescriptor","9","Displaced by Afghan Evacuation US Operation Allies Welcome","Displaced by Afghan Evacuation US Operation Allies Welcome","58"
"Core","uri://education.mn.gov/StudentCharacteristicDescriptor","StudentCharacteristicDescriptor","Active Duty Parent (ADP)","Active Duty Parent (ADP)","Active Duty Parent (ADP)","24"
"Core","uri://education.mn.gov/StudentCharacteristicDescriptor","StudentCharacteristicDescriptor","American Indian - Alaskan Native (Minnesota)","American Indian - Alaskan Native (Minnesota)","American Indian - Alaskan Native (Minnesota)","44"
"Core","uri://education.mn.gov/StudentCharacteristicDescriptor","StudentCharacteristicDescriptor","Immigrant","Immigrant","Immigrant","9"
"Core","uri://education.mn.gov/StudentCharacteristicDescriptor","StudentCharacteristicDescriptor","Migrant","Migrant","Migrant","7"
"Core","uri://education.mn.gov/StudentCharacteristicDescriptor","StudentCharacteristicDescriptor","Recently Arrived English Learner (RAEL)","Recently Arrived English Learner (RAEL)","Recently Arrived English Learner (RAEL)","39"
"Core","uri://education.mn.gov/StudentCharacteristicDescriptor","StudentCharacteristicDescriptor","SLIFE","Student with Limited or Interrupted Formal Education (SLIFE)","Student with Limited or Interrupted Formal Education (SLIFE)","60"
